genre,name,artists_name,album_name,album_release_date,duration_ms,popularity,track_number,uri
edm,Eyes Wide Shut,"ILLENIUM, Avril Lavigne, Travis Barker",Hot Hits Bop,2024-05-18,152331,0,43,spotify:track:2u8slKJ6boOSfcQ5NP3ium
edm,Raw Joy,AA Sound System,Laissez faire...,2006-01-01,182640,0,4,spotify:track:6LD3dvmlPn1cvuI9mac0Vm
edm,Kids Love To Play - Ash Roy remix,"Ash Roy, Arnold From Mumbai",Kids Love To Play,2012-01-10,397000,0,3,spotify:track:2q9y10weZIx5GDUtT81It3
edm,Break Free - Original Mix,"Tempo Giusto, Gabriel Thomas, Catie Leta","Infinite Flame, Vol. 7",2023-08-24,215967,0,3,spotify:track:5hqt2CzHdAT3VvmjbUG02M
edm,Get Get Down - Radio Mix,"R3HAB, Addy Van Der Zwan",Get Get Down,2009-11-23,159375,0,1,spotify:track:2MUiWTV7Aw8i0RunJBNtQN
edm,ATOMIC,KO3,BADASS Screaming Bomb Screening 4DX Original Soundtrack,2017-05-05,225146,0,5,spotify:track:13QHkZyxoBJksnbeZpQ1nD
edm,Portland,Jay Sparrow,The Running,2008-08-05,231533,0,8,spotify:track:73KQghGsTPinNzVrNoKlsi
edm,Twilight Tonight - D-Mad Remix,ARTY,Ultimate Trance Remixes,2013-08-12,400000,0,5,spotify:track:0Wsf2ySlARLbG4mKlzIASy
edm,Night Radio,FASSounds,Autumn Tunes vol. 1,2022-08-20,130983,0,9,spotify:track:014QqkJGSv94tOB28b8aeY
edm,Fashion World,"Brian Cua, David Redwitz, Mark Nolan","Fashion Tracks, Vol. 4",2011-07-18,172308,0,3,spotify:track:2H1fHDx6avBdpiVz99YXA2
edm,Egg producing traitors,Voter Kernel,We mustn't be sick on them,2022-09-03,135255,0,7,spotify:track:67fZfaEPVEsupQfYMBn8V5
edm,Nightwalkers - DJ Tht Radio Edit,"Raaban, Evana",50 Hall of Fame Hands Up Sounds,2014-11-28,208333,0,29,spotify:track:1J0nxpGsmUJ3A3VSCBRpiD
edm,Seeds of Love,Vexento,Powerful EDM,2021-09-07,213873,0,3,spotify:track:1gi7SEeF8u0ZScZKaIIsL2
edm,Life,John Dahlbäck,Dorm Room: Electronic,2021-01-22,379692,0,12,spotify:track:5O9M5Ul7xQAYcfH8sRDtUJ
edm,Inspiring Story,FASSounds,Inspiring Story,2024-03-25,116630,0,1,spotify:track:1ZBvHjBWyf1oJlj6KHH6gH
edm,She's My Summer (feat. Pitbull) [Robert Abigail Vocal Remix],"Lotus, Honorebel",She’s My Summer (Robert Abigail Remixes) (feat. Pitbull),2015-07-31,295238,0,2,spotify:track:3tNe9MwBtKCVwAMX89p85G
edm,Some Hilarious Talking,Andrew Scott,Bloodground,2015-07-31,15053,0,12,spotify:track:58FtMXQmDhL1NjAuTIbsV5
edm,I Want the DJ - Instrumental Version,"Brian Cua, David Redwitz, Mark Nolan","Chart Vibes, Vol. 3",2012-04-04,170926,0,20,spotify:track:35wKt3drV0QU7sCi8DxkAw
edm,The first initiation,Overdream,Mystagogue,2022-01-21,441081,0,7,spotify:track:25jrGtp5kI4t9PajpfSpnd
edm,Last Night - Original Mix,"Mischa Daniels, Crown",FAME Recordings Collected,2012-07-06,527557,0,1,spotify:track:2C5HlGA1AVZ6cTedEAgt43
edm,Eu Vou Te Esperar,"Klamboo, Lorena Chaves, Onaje One",Austro House Hits 2018,2018-08-31,191219,0,11,spotify:track:3JpuLerhiIBd9ukJdJcdgL
edm,"Star Wars Main Theme (From ""Star Wars IV: A New Hope"") [The Avengers (From ""The Avengers"") [Chiptune]",Funny Boy,Disney Classics as Chiptune,2020-09-23,74274,0,5,spotify:track:4jB3c8yosK6D29rM8XTkEN
edm,The Fix (Broken Hearts),Hungry Hollow,The Fix (Broken Hearts),2016-12-16,202167,0,1,spotify:track:6oyyRnyhjSZOCTV0fuqlfv
edm,ID (Chillness),Alex Skrindo,Ideal Chillout Music For Coffee Breaks,2017-04-07,177031,0,3,spotify:track:6d5aicrMDpZiED45wXBliK
edm,Morning Rain - Wake Up Call Mix,Chocolate Puma,Morning Rain EP,2008-11-04,393448,0,2,spotify:track:1uhHxavr9ZfwOZjjVw9XDi
edm,Emotional Healing - Instrumental Remix,"Brian Cua, David Redwitz, Mark Nolan",Chart Vibes: The Remixes,2014-07-22,135746,0,14,spotify:track:2xBoARN1XfraPML3IKvqKb
edm,Lifted - Mat Zo Remix,"Tritonal, Cristina Soto, Mat Zo","Andy Moor presents Breaking The Silence, Vol. 2 (Extended Versions - Part 1)",2011-05-13,471500,0,9,spotify:track:6eNpycbIJbGoN5ylWDCiL4
edm,Fire in the Sky,"Project 91, Nathan Brumley",Bass Boosted House Music,2022-02-25,270476,0,17,spotify:track:1uq87J6KHObQ71zOuAbJkW
edm,Without You,Doug Hoyer,To Be a River,2013-05-28,199026,0,6,spotify:track:5BHwRFp8ePtvbt2jKokY0o
edm,Nightrider - Extended Mix,Bravetone,Nightrider,2021-03-01,245714,0,2,spotify:track:25hG6hRlXZtWKswIColF3n
edm,Surf's Up,Doug Hoyer,To Be a River,2013-05-28,212600,0,11,spotify:track:5tndkYCHn2kWQFGDWINQyC
edm,Gold Star Swimmer,Hot Panda,"Volcano, Bloody Volcano",2009-02-10,273320,0,8,spotify:track:21XImrdBeoGq6Gq0qQKUfX
edm,Absolute - Original Mix,Kash Trivedi,Classic,2016-10-17,362000,0,13,spotify:track:3RTL844C4rNoFW9tJez8TF
edm,Warm Blanket,FASSounds,Rainy Night,2021-07-18,136124,0,4,spotify:track:16JUiVqGOQS0Fa6Vgli5Ru
edm,If the Moon,The Suitable Men,If the Moon,2017-08-01,365453,0,12,spotify:track:1lGVBg9vZOpZB3Uuy0hxgz
edm,Musik For Girls,Screwtape Lewis,Finding Ways To Selfdestruct,2008-08-15,258933,0,3,spotify:track:03mQQfTOYl0lO2eeiKSIsq
edm,Escape - Vintage Rhodes Remix,"Belmar, Vintage Rhodes",Under the Sheets (Remixed),2018-01-12,240651,0,2,spotify:track:2DIWRfRaxuXJ6A8xHYHHfi
edm,Waiting - W&W Remix,"Dash Berlin, Emma Hewitt, W&W",Electronic Dance Marathon: Vegas,2013-06-14,265846,0,6,spotify:track:47d9PR8lcjhM6cY3DFuVUQ
edm,Fire in the Sky,"Project 91, Nathan Brumley",EDM Music 2022,2022-01-16,270476,0,5,spotify:track:0VD5yNuYVl0IPMYZsoTdIq
edm,Stones,Amethysts,Amethysts (Deluxe Extended Edition),2022-05-25,245202,0,7,spotify:track:5Syck2aE3tT7MCTfSfcFZu
edm,Faraway World,FASSounds,Amusement Park,2020-11-25,97545,0,10,spotify:track:1NIDiXXCDA1voJrRFgykGD
edm,Nightwalkers - DJ Tht Edit,"Raaban, Evana",Rgmusic Records 10 Years Anniversary Party - Hands Up Edition,2014-12-12,208333,0,64,spotify:track:5qzY5tc4EpB0qXsgdvLiJ6
edm,Still With Me - Club Mix,"Tritonal, Cristina Soto",Forever Trance Volume Four,2013-07-31,476590,0,6,spotify:track:7w6IZXTBBNuOToa9gRzmxZ
edm,It's Easy,The Provincial Archive,The Provincial Archive,2015-11-20,198149,0,4,spotify:track:3UR74UE7E9qohiWYNOzpkw
edm,No.10,DJ BENGAKU,EDM - Part 1,2017-03-13,172500,0,10,spotify:track:7mHflCpxohddyUmuj8UT7C
edm,The Balance Of The Soul - Michal Jesensky Remix,"Foxa, Michal Jesensky",The Balance Of The Soul,2010,405000,0,1,spotify:track:4lrDuCd1DAKyBCGSv812gq
edm,Fade,Russ Dawson,Vietnamese,2016-08-21,217933,0,9,spotify:track:6pbWYGchY1ZD1lJkkUwqgf
edm,Eyes Wide Shut,"ILLENIUM, Avril Lavigne, Travis Barker",Rock Me,2024-06-01,152331,0,19,spotify:track:7BzioRvONTvvSONuKwwZSZ
edm,First Time,"ILLENIUM, iann dior",Festival Anthems: Pop,2022-04-15,165779,0,28,spotify:track:45DvB7WQ5LPeKRMymIST6K
edm,fall for you,Steve James,+ one,2020-02-14,197253,0,4,spotify:track:0ivbWQ88X8bk4FdCB643Ad
dance,Olvidarte (feat. Emilia),"Gordo, Emilia",NO HAY VERANO SIN GORDO,2024-12-13,157500,66,5,spotify:track:39KyQTzp1dr7jab7et2PlH
dance,Olvidarte (feat. Emilia),"Gordo, Emilia",Olvidarte (feat. Emilia),2024-12-13,157500,65,1,spotify:track:7yif9yIhSCxhcPExFOktCp
dance,Stop Crying Your Heart Out,Oasis,Heathen Chemistry,2002-02-03,303133,77,4,spotify:track:5YciOakY5dB5dULkiLdCaf
dance,Don't Look Back in Anger - Remastered,Oasis,(What's The Story) Morning Glory? [Remastered],1995-10-02,289560,77,4,spotify:track:0UvCh63URrLFcPkKt99hHd
dance,Titanium (feat. Sia),"David Guetta, Sia",Nothing but the Beat (Ultimate Edition),2012-12-07,245040,85,1,spotify:track:0TDLuuLlV54CkRRUOahJb4
dance,I'm Good (Blue),"David Guetta, Bebe Rexha",I'm Good (Blue),2022-08-26,175238,87,1,spotify:track:4uUG5RXrOk84mYEfFvj3cK
dance,"What Is Love - 7"" Mix",Haddaway,The Album,1993-09-13,270373,83,1,spotify:track:0OTO8ZF2YqFQVw9hnZylTd
dance,EL MAYOR DE LOS RANAS (Latin Tech),facunditoo deejay,EL MAYOR DE LOS RANAS (Latin Tech),2025-05-05,168004,57,1,spotify:track:3p9GlykG8FKIjAmpAcybLW
dance,"Freed From Desire - prod. Molella, Phil Jay","Gala, Molella, Phil Jay",Come Into My Life (The Album),1997-11-17,213394,81,10,spotify:track:3u5N55tHf7hXATSQrjBh2q
dance,Outside (feat. Ellie Goulding),"Calvin Harris, Ellie Goulding",Motion,2014-10-31,227266,87,6,spotify:track:7MmG8p0F9N3C4AXdK6o6Eb
dance,I Adore You (feat. Daecolm),"HUGEL, Topic, Arash, Daecolm",I Adore You (feat. Daecolm),2024-07-19,214000,89,1,spotify:track:5nPbKG04fhLkIAjcPFaZq7
dance,Memories (feat. Kid Cudi),"David Guetta, Kid Cudi",One More Love,2010-11-22,210093,83,4,spotify:track:7fLzbEOBOae9lUnOwr7Tse
dance,Sexy Bitch (feat. Akon),"David Guetta, Akon",One More Love,2010-11-22,195853,82,3,spotify:track:2dGxjfhFXDIUX9h5ImyKkE
dance,Show Me Love,"WizTheMc, bees & honey",Show Me Love,2025-02-07,176965,92,1,spotify:track:5ITV0zqzjOYfFWpW0xBmRa
dance,Black Friday (pretty like the sun),"Lost Frequencies, Tom Odell",Black Friday (pretty like the sun),2024-07-19,145599,85,1,spotify:track:4MSj19TwYBLgDFj3ddEeco
dance,Are You With Me,Lost Frequencies,Less Is More,2016-10-21,138013,83,12,spotify:track:4255amV4enzl28KAn16rUO
dance,World Hold On (Children Of The Sky) - FISHER Rework,"Bob Sinclar, FISHER, Steve Edwards",World Hold On (Children Of The Sky) [FISHER Rework],2022-07-08,178304,79,1,spotify:track:6kTwzV93qpcovlRPmBOXmn
dance,Summer,Calvin Harris,Motion,2014-10-31,222533,87,8,spotify:track:6YUTL4dYpB9xZO5qExPf05
dance,Feel So Close - Radio Edit,Calvin Harris,18 Months,2012-10-29,206413,85,3,spotify:track:1gihuPhrLraKYrJMAEONyc
dance,Move,"Adam Port, Stryv, Keinemusik, Orso, Malachiii",Move,2024-06-07,177598,87,1,spotify:track:1BJJbSX6muJVF2AK7uH1x4
dance,The Sound of Silence - CYRIL Remix,"Disturbed, CYRIL",The Sound of Silence (CYRIL Remix),2024-02-02,185238,84,1,spotify:track:1LY3GhF0zxIVgbYEQjCbUO
dance,You & Me - Rivo Remix,"Disclosure, Eliza Doolittle, Rivo",You & Me (Rivo Remix),2023-12-22,208524,84,1,spotify:track:0xoYZ45fgTfyQYREZPN7Sa
dance,Blessings,"Calvin Harris, Clementine Douglas",Blessings,2025-05-09,219650,89,1,spotify:track:78nx0HDJIFD5xDq2L5420Z
dance,CHINGON,"Martinwhite, NEMJ",CHINGON,2024-07-19,134778,69,1,spotify:track:6UNLWd8LUk9nNgmU6AcXct
dance,Blame (feat. John Newman),"Calvin Harris, John Newman",Motion,2014-10-31,212960,83,3,spotify:track:07nH4ifBxUB4lZcsf44Brn
dance,GUARACHETTE,"Martinwhite, Dj Rocka",GUARACHETTE,2024-04-26,162461,64,1,spotify:track:0Yzdl9AZTuvEmKOmNJye89
dance,Live Forever,Oasis,Definitely Maybe,1994-08-29,276866,71,3,spotify:track:1KgfeuVn5OlsBEtoEmBa1t
dance,Sugar (feat. Francesco Yates),"Robin Schulz, Francesco Yates",Sugar,2015-09-25,219043,83,2,spotify:track:5tf1VVWniHgryyumXyJM7w
dance,"Stayin' Alive - From ""Saturday Night Fever"" Soundtrack",Bee Gees,Greatest,1979-01-01,285373,81,5,spotify:track:3mRM4NM8iO7UBqrSigCQFH
dance,Waiting For Love,Avicii,Stories,2015-10-02,230613,83,1,spotify:track:2P4OICZRVAQcYAV2JReRfj
dance,Instant Crush (feat. Julian Casablancas),"Daft Punk, Julian Casablancas",Random Access Memories,2013-05-20,337560,79,5,spotify:track:2cGxRwrMyEAp8dEbuZaVv6
dance,All That She Wants,Ace of Base,The Sign,1993-12-24,211213,82,1,spotify:track:6kWJvPfC4DgUpRsXKNa9z9
dance,MARTINWHITE | DJ TAO Turreo Sessions #28,"DJ Tao, Martinwhite",MARTINWHITE | DJ TAO Turreo Sessions #28,2025-05-01,138009,64,1,spotify:track:4r17F7bDkjMgTxLtPQk8pp
dance,Tarzan Boy,Baltimora,Living In The Background,1985-01-01,378946,74,1,spotify:track:273uCXd7NPrInaiNqtkOrA
dance,There Is a Light That Never Goes Out - 2011 Remaster,The Smiths,The Queen Is Dead,1986-06-16,244586,84,9,spotify:track:0WQiDwKJclirSYG9v5tayI
dance,Lady - Hear Me Tonight,Modjo,Modjo (Remastered),2001,307153,83,3,spotify:track:49X0LAl6faAusYq02PRAY6
dance,Can't Get You out of My Head,Kylie Minogue,Fever,2001-10-01,230640,82,3,spotify:track:3E7ZwUMJFqpsDOJzEkBrQ7
dance,One Kiss (with Dua Lipa),"Calvin Harris, Dua Lipa",One Kiss (with Dua Lipa),2018-04-06,214846,82,1,spotify:track:7ef4DlsgrMEH11cDZd32M6
dance,One More Time,Daft Punk,Discovery,2001-03-12,320357,80,1,spotify:track:0DiWol3AO6WpXZgp0goxAV
dance,Buscando Money,"TWENTY SIX, Tayson Kryss",Buscando Money,2024-02-23,150000,70,1,spotify:track:6vsKOJPjdxlYgRs8McgtCQ
dance,Stumblin' In,CYRIL,Stumblin' In,2023-11-10,213363,86,1,spotify:track:0h3Xy4V4apMraB5NuM8U7Z
dance,Catch & Release - Deepend Remix,"Matt Simons, Deepend",When The Lights Go Down,2015-09-30,195173,75,6,spotify:track:11BAVEGi1ivJ6JWLqKUNrZ
dance,Prayer in C - Robin Schulz Radio Edit,"Lilly Wood and The Prick, Robin Schulz",Prayer in C,2014-05-16,189413,79,1,spotify:track:5fnA9mkIfScSqHIpeDyvck
dance,This Is What You Came For,"Calvin Harris, Rihanna",96 Months,2024-08-08,221900,82,3,spotify:track:2vlDrKpOC0eSTqTDRcbYyw
dance,Champagne Supernova - Remastered,Oasis,(What's The Story) Morning Glory? [Remastered],1995-10-02,451320,71,12,spotify:track:1wo3UYTeizJHkwYIuLuBPF
dance,Thank You (Not So Bad),"Dimitri Vegas & Like Mike, Tiësto, Dido, W&W, Dimitri Vegas, Like Mike",Thank You (Not So Bad),2023-12-01,140000,84,1,spotify:track:09CnYHiZ5jGT1wr1TXJ9Zt
dance,Don't You Worry Child - Radio Edit,"Swedish House Mafia, John Martin",Don't You Worry Child,2012-09-14,212862,83,1,spotify:track:2V65y3PX4DkRhy1djlxd9p
dance,Stand by Me,Oasis,Be Here Now,1997-07-08,356600,69,4,spotify:track:7aSSsHnGQ54rbMZpXApmtU
dance,Waves - Robin Schulz Radio Edit,"Mr. Probz, Robin Schulz",Waves (Robin Schulz Radio Edit),2014-02-07,208133,83,1,spotify:track:1HFfMOxCAT4GAwaPfCdmUs
dance,Play Hard (feat. Ne-Yo & Akon),"David Guetta, Ne-Yo, Akon",Nothing but the Beat (Ultimate Edition),2012-12-07,201000,78,6,spotify:track:5YPMEOJ58kfl56VHxTgwx3
electronic,DIA DELÍCIA,"Nakama, Mc Staff, ΣP",DIA DELÍCIA,2025-04-25,75461,90,1,spotify:track:094IjHeVUviN4aBnSXYsuj
electronic,PASSO BEM SOLTO - Slowed,ATLXS,PASSO BEM SOLTO,2024-04-23,116072,89,3,spotify:track:4sTlQPMyoFMPdhAJvErBN3
electronic,LUNA BALA - Slowed,"Yb Wasg'ood, Ariis",LUNA BALA,2025-04-18,124110,88,2,spotify:track:49t3uvN9hUNefdvtaD6HBj
electronic,Stop Crying Your Heart Out,Oasis,Heathen Chemistry,2002-02-03,303133,77,4,spotify:track:5YciOakY5dB5dULkiLdCaf
electronic,Vem Vem,"Jmilton, MC Xangai",Vem Vem,2025-05-30,83183,85,1,spotify:track:2FnkrCrbXJuebXxnVtXiHI
electronic,MONTAGEM BAILÃO,"Repsaj, ATLXS, Mc Jhey",MONTAGEM BAILÃO,2025-04-04,103727,87,1,spotify:track:1RnPdd7EKKhKN3E4o4DRsh
electronic,Don't Look Back in Anger - Remastered,Oasis,(What's The Story) Morning Glory? [Remastered],1995-10-02,289560,77,4,spotify:track:0UvCh63URrLFcPkKt99hHd
electronic,Titanium (feat. Sia),"David Guetta, Sia",Nothing but the Beat (Ultimate Edition),2012-12-07,245040,85,1,spotify:track:0TDLuuLlV54CkRRUOahJb4
electronic,I'm Good (Blue),"David Guetta, Bebe Rexha",I'm Good (Blue),2022-08-26,175238,87,1,spotify:track:4uUG5RXrOk84mYEfFvj3cK
electronic,"What Is Love - 7"" Mix",Haddaway,The Album,1993-09-13,270373,83,1,spotify:track:0OTO8ZF2YqFQVw9hnZylTd
electronic,MONTAGEM XONADA,"MXZI, Dj Samir, DJ Javi26",MONTAGEM XONADA,2025-07-02,75682,83,1,spotify:track:2Gs0iF27my40p0dANv2rAg
electronic,"Freed From Desire - prod. Molella, Phil Jay","Gala, Molella, Phil Jay",Come Into My Life (The Album),1997-11-17,213394,81,10,spotify:track:3u5N55tHf7hXATSQrjBh2q
electronic,LOS VOLTAJE,"Sayfalse, Yb Wasg'ood, Ariis",LOS VOLTAJE,2025-04-11,99285,85,1,spotify:track:4LkkRLP8pldQer1YRrHwkx
electronic,MENTE MÁ,"Nakama, Mc Staff",MENTE MÁ,2025-05-16,75302,84,1,spotify:track:11gZL0HigsqfzjTHOpdFjE
electronic,Outside (feat. Ellie Goulding),"Calvin Harris, Ellie Goulding",Motion,2014-10-31,227266,87,6,spotify:track:7MmG8p0F9N3C4AXdK6o6Eb
electronic,Memories (feat. Kid Cudi),"David Guetta, Kid Cudi",One More Love,2010-11-22,210093,83,4,spotify:track:7fLzbEOBOae9lUnOwr7Tse
electronic,Funk de Beleza - Slowed,"Nateki, Scythermane, MC MAYAH",Funk de Beleza,2024-10-04,145115,82,2,spotify:track:43jExF2HeZ6cJIGrWF0ie4
electronic,Sexy Bitch (feat. Akon),"David Guetta, Akon",One More Love,2010-11-22,195853,82,3,spotify:track:2dGxjfhFXDIUX9h5ImyKkE
electronic,Black Friday (pretty like the sun),"Lost Frequencies, Tom Odell",Black Friday (pretty like the sun),2024-07-19,145599,85,1,spotify:track:4MSj19TwYBLgDFj3ddEeco
electronic,Are You With Me,Lost Frequencies,Less Is More,2016-10-21,138013,83,12,spotify:track:4255amV4enzl28KAn16rUO
electronic,MONTAGEM TOMADA - Slowed,MXZI,MONTAGEM TOMADA,2025-03-21,84901,84,2,spotify:track:2HJQm4T3Pk2zvxoFhlnGjR
electronic,MONTAGEM TOMADA,MXZI,MONTAGEM TOMADA,2025-03-21,71392,83,1,spotify:track:2UEyo3ufg8DvO0zYMJWG7R
electronic,Summer,Calvin Harris,Motion,2014-10-31,222533,87,8,spotify:track:6YUTL4dYpB9xZO5qExPf05
electronic,Feel So Close - Radio Edit,Calvin Harris,18 Months,2012-10-29,206413,85,3,spotify:track:1gihuPhrLraKYrJMAEONyc
electronic,The Sound of Silence - CYRIL Remix,"Disturbed, CYRIL",The Sound of Silence (CYRIL Remix),2024-02-02,185238,84,1,spotify:track:1LY3GhF0zxIVgbYEQjCbUO
electronic,You & Me - Rivo Remix,"Disclosure, Eliza Doolittle, Rivo",You & Me (Rivo Remix),2023-12-22,208524,84,1,spotify:track:0xoYZ45fgTfyQYREZPN7Sa
electronic,Blessings,"Calvin Harris, Clementine Douglas",Blessings,2025-05-09,219650,89,1,spotify:track:78nx0HDJIFD5xDq2L5420Z
electronic,Blame (feat. John Newman),"Calvin Harris, John Newman",Motion,2014-10-31,212960,83,3,spotify:track:07nH4ifBxUB4lZcsf44Brn
electronic,Live Forever,Oasis,Definitely Maybe,1994-08-29,276866,71,3,spotify:track:1KgfeuVn5OlsBEtoEmBa1t
electronic,Sugar (feat. Francesco Yates),"Robin Schulz, Francesco Yates",Sugar,2015-09-25,219043,83,2,spotify:track:5tf1VVWniHgryyumXyJM7w
electronic,Waiting For Love,Avicii,Stories,2015-10-02,230613,83,1,spotify:track:2P4OICZRVAQcYAV2JReRfj
electronic,All That She Wants,Ace of Base,The Sign,1993-12-24,211213,82,1,spotify:track:6kWJvPfC4DgUpRsXKNa9z9
electronic,Montagem Bandido,"Jmilton, Itamar Mc",Montagem Bandido,2025-05-02,86953,79,1,spotify:track:5s9JKS0P0exKgwLe4yCjAK
electronic,Montagem Bandido - Slowed,"Jmilton, Itamar Mc",Montagem Bandido,2025-05-02,97606,80,2,spotify:track:2spuCBVvQyCsQFHIiie8gP
electronic,NUNCA MUDA?,"Scythermane, NXGHT!, MC Fabinho da Osk",NUNCA MUDA?,2025-01-09,81500,83,1,spotify:track:5EIjpM1B1VsLoKvv2iwd0P
electronic,RITMO DE VERAO - SLOWED,"GXMZ, SEKIMANE, Repsaj",RITMO DE VERAO,2025-03-07,99194,79,2,spotify:track:344ilORk7mOQH1BbiufL9w
electronic,There Is a Light That Never Goes Out - 2011 Remaster,The Smiths,The Queen Is Dead,1986-06-16,244586,84,9,spotify:track:0WQiDwKJclirSYG9v5tayI
electronic,One More Time,Daft Punk,Discovery,2001-03-12,320357,80,1,spotify:track:0DiWol3AO6WpXZgp0goxAV
electronic,FUNK DO BOUNCE (Slowed),Ariis,FUNK DO BOUNCE (Slowed),2024-08-30,107539,81,1,spotify:track:7IBqHkoP94VrgYKVns4eNz
electronic,Prayer in C - Robin Schulz Radio Edit,"Lilly Wood and The Prick, Robin Schulz",Prayer in C,2014-05-16,189413,79,1,spotify:track:5fnA9mkIfScSqHIpeDyvck
electronic,This Is What You Came For,"Calvin Harris, Rihanna",96 Months,2024-08-08,221900,82,3,spotify:track:2vlDrKpOC0eSTqTDRcbYyw
electronic,I Took A Pill In Ibiza - Seeb Remix,"Mike Posner, Seeb","At Night, Alone.",2016-05-06,197933,83,13,spotify:track:0vbtURX4qv1l7besfwmnD8
electronic,Champagne Supernova - Remastered,Oasis,(What's The Story) Morning Glory? [Remastered],1995-10-02,451320,71,12,spotify:track:1wo3UYTeizJHkwYIuLuBPF
electronic,Thank You (Not So Bad),"Dimitri Vegas & Like Mike, Tiësto, Dido, W&W, Dimitri Vegas, Like Mike",Thank You (Not So Bad),2023-12-01,140000,84,1,spotify:track:09CnYHiZ5jGT1wr1TXJ9Zt
electronic,World Hold On (Children of the Sky) - Radio Edit,"Bob Sinclar, Steve Edwards",World Hold On (Children of the Sky) [Radio Edit],2006-06-06,199194,79,1,spotify:track:3HGwI9qwq5XqBDeZBV3zti
electronic,Don't You Worry Child - Radio Edit,"Swedish House Mafia, John Martin",Don't You Worry Child,2012-09-14,212862,83,1,spotify:track:2V65y3PX4DkRhy1djlxd9p
electronic,Stand by Me,Oasis,Be Here Now,1997-07-08,356600,69,4,spotify:track:7aSSsHnGQ54rbMZpXApmtU
electronic,Waves - Robin Schulz Radio Edit,"Mr. Probz, Robin Schulz",Waves (Robin Schulz Radio Edit),2014-02-07,208133,83,1,spotify:track:1HFfMOxCAT4GAwaPfCdmUs
electronic,Play Hard (feat. Ne-Yo & Akon),"David Guetta, Ne-Yo, Akon",Nothing but the Beat (Ultimate Edition),2012-12-07,201000,78,6,spotify:track:5YPMEOJ58kfl56VHxTgwx3
electronic,Without You (feat. Usher),"David Guetta, USHER",Nothing but the Beat (Ultimate Edition),2012-12-07,208133,79,4,spotify:track:3UN6cIn3VIyg0z1LCuFSum
